case_id,patient_filename,text,summ,corrected
TCGA-OR-A5K5,TCGA-OR-A5K5.6EA3FB77-3DD4-43C8-8C39-CA8755EBC50C,"PREVIOUS DIAGMOSIS INOUTRY. 2. SEX: F. BIRTHDATE: ADM DATE: OPER DATE: PROCEDURE: SPHS. Patient with left adrenal mass. PROCEDURE: SPGD. 1. ""L adrenal mass"" Received fresh for frozen section is a fully-encapsulated,. 447 gram, excision specimen (up to 14.5 cm x up to 9.5 cm x up to 6 cm). Inked. green on its entire exterior capsule and bivalved to reveal an interior,. mottled red-brown and orange, with areas highly suspicious for necrosis. Sampled for frozen section analysis and extensively for tissue procurement. Extensively sectioned to reveal scant extratumoral adipose, no attached Lymph. nodes, and no identifiable uninvolved adrenal tissue. Gross estimation of. necrotic tumor mass approximately 30%. 1A. Frozen section control. 1B-c. Large central sections of Lesion. 1D-K. Additional sections showing full range of gross morphology of the Lesion. and sampling margins from which it is grossly free. greater than one. section per cm of tumor). 2. ""Left periaortic lymph node packet"" Received in formalin in a small. container is a lymphadenectomy specimen (4 x 3 x 2 cm). Serially sectioned to. reveal multiple small Lymph node candidates. 2A-D. ,. candidates, small amount of adipose tissue). 3. ""Left suprarenal periaortic lymph nodes"" Received in formalin in a small. container is a lymphadenectomy specimen (2 x 2 x 0.6 cm). Dissected, the. specimen appears to consist predominantly of vascular tissue. Submitted. entirely in cassette 3A. PREVIOUS DIAGNOSIS INQUIRY. 3. SEX: F. ADM DATE: BIRTHDATE: OPER DATE: FROZEN SECTION REPORT. 1. Positive for carcinoma. Frozen section diagnosis is confirmed. PROCEDURE: SPMI. ADRENOCORTICAL CARCINOMA. Tumor Size: 14.5 x 9.5 x 6 cm. Tumor Weight: 447 grams. Capsular Invasion: Yes. Vascular Invasion: Yes. Surgical Margins: Negative but close. Necrosis: Mitotic Rate: 31 mitoses / 50 high power fields. Grade: High. Lymph nodes status: Negative (0/20). Extra-adrenal extension: Yes, focal. Stage: III (extra-adrenal extension). Immunchistochemistry Results: NA. PROCEDURE: SPDX. 1. Left adrenal gland, resection: Adrenocortical carcinoma, high-grade by. mitotic rate, margins negative but close. See Template. PREVIOUS DIAGNOSIS INQUIRY. SEX: F. BIRTHDATE: ADM DATE: OPER DATE: 2. Lymph node, left periaortic, excision: Twenty lymph nodes negative for. carcinoma (0/20). 3. Soft tissue, left suprarenal, excision: Ganglion and fibrovascular tissue,. negative for carcinoma. the signing staff pathologist, have. personally examined and interpreted the slides from this case. END OF PREVIOUS DIAGNOSIS INQUIRY.","The patient is a female with a left adrenal mass. The frozen section analysis revealed a fully-encapsulated, 447-gram, 14.5 x 9.5 x 6 cm adrenocortical carcinoma with a high mitotic rate of 31 mitoses per 50 high power fields, indicating a high-grade tumor. The tumor showed capsular invasion, vascular invasion, and focal extra-adrenal extension, with a stage of III. The surgical margins were negative but close. The lymph nodes examined were negative for carcinoma, with 20 lymph nodes showing no evidence of cancer. The microscopic description revealed a mottled red-brown and orange interior with areas highly suspicious for necrosis, and scant extratumoral adipose tissue with no attached lymph nodes or identifiable uninvolved adrenal tissue.","The patient is a female with a left adrenal mass. The frozen section analysis revealed a fully-encapsulated, 447-gram, 14.5 x 9.5 x 6 cm adrenocortical carcinoma with a high mitotic rate of 31 mitoses per 50 high power fields, indicating a high-grade tumor. The tumor showed capsular invasion, vascular invasion, and focal extra-adrenal extension, with a stage of III. The surgical margins were negative but close. The lymph nodes examined were negative for carcinoma, with 20 lymph nodes showing no evidence of cancer. The microscopic description revealed a mottled red-brown and orange interior with areas highly suspicious for necrosis, and scant extratumoral adipose tissue with no attached lymph nodes or identifiable uninvolved adrenal tissue."
TCGA-A2-A0T0,TCGA-A2-A0T0.6F5EBE67-0A25-4B20-A1F6-9CE6C4FF4096,"SURGICAL REPORT. Sex: F. Date Collected: Date Received: M.R. Number: Account Number. Doctor: PRE-OPERATIVE DIAGNOSIS. LEFT BREAST CANCER. POST-OPERATIVE DIAGNOSIS. LEFT BREAST CANCER. PROCEDURE. LEFT BREAST LUMPECTOMY WITH AXILLARY LYMPH NODE DISSECTION. TISSUES. A. BREAST EXCISION NEEDLE LOC, SIMPLE, MARGINS,ETC - LEFT. B. AXILLARY - CONTENTS LEFT. C. AXILLARY - ADDITIONAL CONTENTS LEFT. D. MARGINS - ADDITIONAL LATERAL. E. MARGINS - ADDITIONAL MEDIAL. ADDENDUM 2. HER-2 (IHC) -. o. NOT AMPLIFIED. SPECIAL STAINS PERFORMED: Her-2 (IHC) (HA). Revlewed and electronically signed out by: ADDENDUM. ESTROGEN AND PROGESTERONE RECEPTOR RESULTS: ESTROGEN RECEPTORS -. NEGATIVE IN THE MALIGNANT CELLS (0%). PROGESTERONE RECEPTORS- -. NEGATIVE IN THE MALIGNANT CELLS (0%). Comment: The control tissues for Estrogen and Progesterone Receptor. Immunohistochemical Studies display appropriate staining pattern. 3. SURGICAL REPORT. FS DIAGNOSIS. A. LEFT BREAST LUMP (GROSS MARGINS) -. PORTION OF BREAST TISSUE WITH TUMOR (3.2 X 3.1 X 3.0 CM.) EXTENDING TO. LATERAL SURGICAL MARGIN AND WITHIN 0.1 CM. OF THE MEDIAL SURGICAL. MARGINS. ALL OF THE REMAINING DESIGNATED SURGICAL MARGINS ARE WITHIN 0.6 CM. OF THE TUMOR (GROSS). (REPORTED TO SURGEON: Diagnosed by: FINAL DIAGNOSIS. A. LEFT BREAST LUMP -. BREAST TISSUE DISPLAYING INVASIVE POORLY DIFFERENTIATED DUCTAL. ADENOCARCINOMA OF THE BREAST, 3+3+3, 3.2 CM. IN GREATEST DIMENSION. TUMOR EMBOLI SEEN IN ANGIOLYMPHATIC SPACES. MARGINS ARE FREE. THE NEAREST MARGIN IS 0.1 CM. TO THE TUMOR AS REPORTED IN THE GROSS. EXAMINATION. B. AXILLARY CONTENTS LEFT -. LYMPH NODE, METASTATIC DUCTAL ADENOCARCINOMA IN TWO LYMPH. NODES FROM A TOTAL OF TWELVE LYMPH NODES (2/12). THE LARGEST NODE WITH TUMOR IS 1 CM. IN GREATEST DIMENSION. THE TUMOR TOTALLY OCCUPIES THE NODE WITH EXTRACAPSULAR. EXTENSION TO THE FAT. C. ADDITIONAL AXILLARY CONTENTS, LEFT -. LYMPH NODES, TWO REACTIVE. D. ADDITIONAL LATERAL MARGINS -. FIBROADIPOSE TISSUE AND BREAST TISSUE, NO TUMOR SEEN; HOWEVER, THERE IS. MICROSCOPIC FOCUS OF TUMOR EMBOLI SEEN IN ANGIOLYMPHATIC SPACES. E. ADDITIONAL MEDIAL MARGINS- -. FIBROADIPOSE TISSUE AND BREAST TISSUE, NO TUMOR SEEN. PTNM CLASSIFICATION: T2 N1 MX, STAGE IIB, DUCTAL ADENOCARCINOMA, G3. PQRI CATEGORY II: 3260F. Diagnosed by: /. COMMENT. This case is discussed with. SURGICAL REPORT. GROSS DESCRIPTION. The specimen is received in five separate containers labeled. designated A. through E. A. The container is received fresh unfixed labeled ""left breast lump"" and consists of a 30 gm. ovoid. mass of apparent fatty and fibrous-encased tissue which is 4.5 x 3.5 x 2.8 cm. in greatest overall. dimension. There is a single short suture indicating superior margin inked with orange, inferior. is. inked red. There is a single long suture indicating lateral margin inked with black dye, medial. is. inked blue. There are two short sutures indicating anterior margin inked with green dye, deep. is. inked yellow. Sectioning reveals a tumor, a gray-white irregular bordered tumor which is 3.2 x 3.1. x 3 cm. in greatest overall dimension and has scattered yellow-tan chalky areas varying up to 0.3. cm. in greatest dimension and a central 0.4 cm. slightly gelatinous hemorrhagic area. The tumor. mass grossly appears to involve the lateral/black margin is 0.1 cm. from the medial/blue, 0.5 cm. from the anterior/green, 0.5 cm. from the deep/yellow, 0.5 cm. from the superior/orange and 0.5. cm. from the inferior/red. Gross margins are obtained by Dr. The entire specimen is. submitted in seventeen blocks. Key Note Block Summary: 1-lateral/black, 2-medial/blue, 3-anterior/green, 4. deep/yellow, 5-superior/orange, 6-inferior/red (all are perpendicular), 7 through 17-remaining. B. The container is received fixed labeled ""left axillary contents"" and consists of an irregular mass of. apparent fat 3.5 x 3 x 2.5 cm. Sectioning reveals pink-tan nodules varying up to 2 cm. in greatest. dimension. The larger nodes are hemisected and placed in cassettes 2 through 5. C. The container is received fixed labeled ""additional axillary contents"" and consists of an irregular. mass of apparent fatty tissue which is 1 x 0.6 x 0.4 cm. Sectioning reveals a 0.4 cm. pink-tan. nodule. The entire specimen is submitted as one section in one block. D. The container is received fresh unfixed labeled ""additional lateral margin"" and consists of an 8. gm. ovoid mass of apparent fatty and fibrous encased tissue is 3 x 2.5 x 2 cm. in greatest overall. dimension. There is an attached suture indicating new lateral margin inked with red dye. Sectioning reveals fat and a scant amount of fibrous tissue. The entire specimen is submitted in. four blocks. E. The container is received fresh unfixed labeled ""additional medial margin - suture on new medial. margin"" and consists of an 8 gm. ovoid mass of apparent fatty and fibrous encased tissue is 3 x. 3. x 2.5 cm. in greatest overall dimension. There is a suture indicating new medial margin inked. with blue dye. The entire specimen is submitted in four blocks. MICROSCOPIC EXAM. MICROSCOPIC EXAMINATION CONDUCTED BY PATHOLOGIST CONFIRMS FINAL DIAGNOSIS. SURGICAL REPORT.","The patient is a female with a preoperative diagnosis of left breast cancer. The postoperative diagnosis is also left breast cancer. The patient underwent a left breast lumpectomy with axillary lymph node dissection. The microscopic examination confirms invasive poorly differentiated ductal adenocarcinoma of the breast, 3+3+3, 3.2 cm in greatest dimension. The tumor emboli are seen in angiolymphatic spaces. The margins are free, with the nearest margin being 0.1 cm to the tumor. Two lymph nodes out of twelve examined are metastatic with ductal adenocarcinoma. The estrogen receptors are negative in the malignant cells (0%), and progesterone receptors are also negative in the malignant cells (0%). The HER-2 (IHC) is not amplified. The PTNM classification is T2 N1 MX, Stage IIB, ductal adenocarcinoma, G3. The PQRI category is 3260F.","The patient is a female with a preoperative diagnosis of left breast cancer. The postoperative diagnosis is also left breast cancer. The patient underwent a left breast lumpectomy with axillary lymph node dissection. The microscopic examination confirms invasive poorly differentiated ductal adenocarcinoma of the breast, 3+3+3, 3.2 cm in greatest dimension. The tumor emboli are seen in angiolymphatic spaces. The margins are free, with the nearest margin being 0.1 cm to the tumor. Two lymph nodes out of twelve examined are metastatic with ductal adenocarcinoma. The estrogen receptors are negative in the malignant cells (0%), and progesterone receptors are also negative in the malignant cells (0%). The HER-2 (IHC) is not amplified. The PTNM classification is T2 N1 MX, Stage IIB, ductal adenocarcinoma, G3. The PQRI category is 3260F."
TCGA-AO-A1KQ,TCGA-AO-A1KQ.EB5199BA-6164-4CFB-AFAA-B41544B83103,"Clinical Diagnosis & History: y/o male with left breast cancer (invasive ductal carcinoma (IDC)). Specimens Submitted: 1: SP: Sentinel node #1, level 1, left axilla (fs). 2: SP: Left breast with levels one and two axillary contents. DIAGNOSIS: 1). LYMPH NODE, LEFT AXILLA, SENTINEL LYMPH NODE #1; LEVEL 1; BIOPSY: METASTATIC CARCINOMA IN ONE LYMPH NODE (1/1). - THE METASTATIC DEPOSIT IS SEEN ONLY ON THE ACTUAL FROZEN SECTION AND. MEASURES AT LEAST. 2 MM. NO EXTRANODAL EXTENSION IDENTIFIED. - THE LYMPH NODE EXHIBITS INCIDENTAL BENIGN CAPSULAR NEVUS CELL. AGGREGATES. 2). BREAST. LEET: MASTECTOMY: - INVASIVE DUCTAL CARCINOMA. NOS TYPE. HISTOLOGIC GRADE III/III (SLIGHT. OR NO TUBULE FORMATION), NUCLEAR GRADE III/III (MARKED VARIATION IN SIZE AND. SHAPE) MEASURING 2.2 CM IN LARGEST DIMENSION MICROSCOPICALLY. - DUCTAL CARCINOMA IN-SITU (DCIS) IS ALSO IDENTIFIED, SOLID, CRIBRIFORM TYPE. WITH HIGH NUCLEAR GRADE AND MODERATE NECROSIS. - THE DCIS CONSTITUTES <= 25% OF THE TOTAL TUMOR MASS, AND IS PRESENT. ADMIXED WITH AND AWAY FROM THE INVASIVE COMPONENT. - THE INVASIVE CARCINOMA IS LOCATED IN THE LOWER INNER QUADRANT AND CENTRAL. AREA (RETROAREOLAR). - THE NIPPLE IS INVOLVED BY INVASIVE CARCINOMA. - A FOCUS OF PERINEURAL INVASION BY CARCINOMA IS SEEN IN THE DERMIS OF. THE NIPPLE REGION. THERE IS ALSO FOCAL LYMPHATIC INVASION IN THE NIPPLE. REGION. - CALCIFICATIONS ARE PRESENT IN THE IN SITU CARCINOMA. - NO INVOLVEMENT OF THE SURGICAL MARGINS BY EITHER INVASIVE OR IN SITU. CARCINOMA IS IDENTIFIED. THE ION-NEOPLASTIC BREAST TISSUE IS UNRENORKAELE. - THE LYMPH NODE STATUS IS AS FOLLOWS (EXPRESSED AS THE NUMBER OF. POSITIVE LYMPH NODES IN RELATION TO THE TOTAL NUMBER OF LYMPH NODES. EXAMINED) : METASTATIC CARCINONA IN ONE OF EIGHT LYMPH NODES (1/8). THIS IS A MACROMETASTASIS (1.8 CM). - THERE IS NO EXTRANODAL EXTENSION OF CARCINOMA. Nc. - RESULTS OF SPECIAL STAINS (ER, PR, HER2-NEU) WILL BE REPORTED AS AN. ADDENDUM. I ATTEST THAT THE ABOVE DIAGNOSIS IS BASED UPON MY PERSONAL EXAMINATION OF. THE SLIDES (AND/OR OTHER MATERIAL), AND THAT I HAVE REVIEWED AND APPROVED. THIS REPORT. Special Studies: Special Stain. Comment. ER-C. PR-C. HER2-0. NEG CONT. NEG-HER2. IMM RECUT. Gross Description: 1) The specimen is received fresh for frozen section consultation labeled,. Sentinel node #1, level 1, left axilla"", and consists of one lymph node. measuring 1.5 x 1.0 x 0.8 cm. The lymph node is bisected and submitted for. frozen section diagnosis. Summary sections: FSC - frozen section control. 2) The specimen is received fresh labeled, ""Left breast with levels one and. two axillary contents, stitch marks axillary tail"" and consists of a breast. measuring 19 x 18 x 3.5 cm with overlying skin ellipse measuring 19 x 11 cm,. attached axillary contents measuring 11 x 10 x 3 cm. The axillary tail is. marked with a black suture. Situated centrally on the skin surface is. a. flattened nipple measuring 0.8 x 0.8 em and areola measuring 2.5 x 2.5 cm. There are no scars or lesions noted on the skin. A suture demarcates the. axillary aspect. The posterior surface of the breast is inked black and the. specimen is serially sectioned to reveal a well circumscribed stony hard. white-tan tumor measuring 2.0 x 2.0 x 1.7 cm, and located 1.8 cm from the. deep margin. The tumor is located subjacent to the nipple The remainder. of. the breast tissue is yellow tan fatty and lobulated. The specimen is. submitted for lymph node dissection. Representative sections are submitted. A sample of the tumor is given to. Summary of sections: N nipple. NB - nipple base. DM - deep margin. T - tumor. UIQ - upper inner quadrant. LIQ - lower inner quadrant. UOQ - upper outer quadrant. LOQ - lower outer quadrant. LN-lymph nodes. Summary of Sections: Part 1: SP: Sentinel node #1, level 1, left axilla (fs). Block. Sect. Site. PCs. 1. FSC. 1. Part 2: SP: Left breast with levels one and two axillary contents. Block. Sect. Site. PCs. 1. dm. 1. 1. lig. 1. 5. LN. 8. 1. log. 1. 1. n. 1. 1. nb. 1. 6. 6. 1. uiq. 1. uog. Procedures/Addenda: Addendum. Date Complete: Addendum Diagnosis. ADDEN. SITK: #2, LEFT BREAST. ER: >95% OF NUCLEAR STAINING WITH STRONG INTENSITY. - PR: >80% OF NUCLEAR STAINING WITH STRONG TO NODERATE INTENSITY. - HER-2/NEU. (Hexcep Test) : NEGATIVE (STAINING INTENSITY OF FOCAL 1+). - CONTROLS ARZ SATISFACTORY. Intracperative Consultation: Note: The diagnoses given in this section pertain only to the tissue sample. examined at the time of the intraoperative consultation. 1). FROZEN SECTION DIAGNOSIS: METASTATIC CARCINOMA. PERMANENT DIAGNOSIS: SAME.","A 40-year-old male with left breast cancer (invasive ductal carcinoma) underwent a mastectomy. The pathology report reveals that the invasive ductal carcinoma is of no specific type, histologic grade III/III, and nuclear grade III/III, measuring 2.2 cm in the largest dimension. The carcinoma is located in the lower inner quadrant and central area (retroareolar) of the breast, involving the nipple, with a focus of perineural invasion by carcinoma in the dermis of the nipple region and focal lymphatic invasion in the nipple region. Ductal carcinoma in situ (DCIS) is also identified, solid, cribiform type, with high nuclear grade and moderate necrosis, constituting less than 25% of the total tumor mass. The lymph node status is 1/8, with a macrometastasis of 1.8 cm, and no extranodal extension of carcinoma. Special studies show estrogen receptor (ER) positivity (>95% of nuclear staining with strong intensity), progesterone receptor (PR) positivity (>80% of nuclear staining with strong to moderate intensity), and HER2-neu negativity.","A male patient with left breast cancer (invasive ductal carcinoma) underwent a mastectomy. The pathology report reveals that the invasive ductal carcinoma is of not otherwise specified, histologic grade III/III, and nuclear grade III/III, measuring 2.2 cm in the largest dimension. The carcinoma is located in the lower inner quadrant and central area (retroareolar) of the breast, involving the nipple, with a focus of perineural invasion by carcinoma in the dermis of the nipple region and focal lymphatic invasion in the nipple region. Ductal carcinoma in situ (DCIS) is also identified, solid, cribiform type, with high nuclear grade and moderate necrosis, constituting less than 25% of the total tumor mass. The lymph node status is 1/8, with a macrometastasis of 1.8 cm, and no extranodal extension of carcinoma. Special studies show estrogen receptor (ER) positivity (>95% of nuclear staining with strong intensity), progesterone receptor (PR) positivity (>80% of nuclear staining with strong to moderate intensity), and HER2-neu negativity."
TCGA-DU-7301,TCGA-DU-7301.8ff62d9f-003f-4194-8cc6-bce45a7cdf1d,"Physician (s) : Phy Locat. CLINICAL HISTORY. Not Given. OPERATIVE DIAGNOSES. Not Given. Operation/Specimen: A: Brain, Left posterior frontal, excision biopsy. B: Brain, enhanced parts of tumor, excision biopsy. PATHOLOGICAL DIAGNOSIS: A, B C, Brain, left posterior frontal, tumor resection: Oligodendroglioma, MIB-1 : about 4%. COMMENT. This tumor is an oligodendroglioma with a microcystic loose. background. Nuclear atypia is mild and mitosis is not found. There is no vascular hyperplasia nor necrosis. PROCEDURES/ADDENDA. MGMT Promoter Methylation. Interpretation. NEGATIVE - No evidence of methylated MGMT promoter is detected. Results-Comments. Received paraffin sections labeled dated. TEST DESCRIPTION: Bisulfite treatment of DNA followed by PCR. amplification of. both methylated and unmethylated MGMT promoter sequences, with. products. detected by gel electrophoresis. FDA COMMENT: The above data are not to be construed as the results. from a. stand-alone diagnostic test. This test was developed and its. performance. characteristics determined by the AP Molecular Pathology laboratory as. required by. regulations. It has not been cleared or approved. for. specific uses by the U.S. Food and Drug Administration (FDA) The FDA. has. determined that such clearance or approval is not necessary. These. results are. provided for informational purposes only, and should be interpreted. only in. the context of established procedures and/or diagnostic criteria. INTRA-OPERATIVE CONSULTATION. Brain, Left posterior frontal, excision biopsy: Glioma, 1 block,. Senior Staff Pathologist. GROSS DESCRIPTION. A. Multiple tissue fragments, 0.2 to 0.5 cm, all in A1, A2. B. SPECIMEN: Enhanced part of tumor. FIXATIVE: None. GENERAL: Received are multiple pink-tan, glistening fragments of soft. tissue,. 2.0 x 1.7 x 0.2 cm in aggregate. SECTIONS: Entirely submitted in B1. ICD-9 (s) : 191.9 191.9. Histo Data. Part A: Brain, Left posterior frontal, excision biopsy. Stain/cnt. Block. Comment. H/E X 1. 1. X 1. 1. H/E X 1. 2. FS H/E x 1. (none). Part B: Brain, enhanced parts of tumor, excision biopsy. Stain/cnt. Block. Comment. mGFAP-DA x 1. 1. H/E X 1. 1. MGMT x 1. 1. MIB1-DA x 1. 1.","The pathology report indicates that the patient underwent an excision biopsy of a brain tumor in the left posterior frontal region. Microscopic examination revealed an oligodendroglioma with a microcystic, loose background. The tumor showed mild nuclear atypia and no mitosis, vascular hyperplasia, or necrosis. The MIB-1 proliferation index was about 4%. The MGMT promoter methylation status was negative, indicating no evidence of methylated MGMT promoter. The tumor was stained with H&E, GFAP-DA, MGMT, and MIB1-DA, with results available for all stains.","The pathology report indicates that the patient underwent an excision biopsy of a brain tumor in the left posterior frontal region. Microscopic examination revealed an oligodendroglioma with a microcystic, loose background. The tumor showed mild nuclear atypia and no mitosis, vascular hyperplasia, or necrosis. The MIB-1 proliferation index was about 4%. The MGMT promoter methylation status was negative, indicating no evidence of methylated MGMT promoter. The tumor was stained with H&E, GFAP-DA, MGMT, and MIB1-DA, with results available for all stains."
TCGA-HT-A617,TCGA-HT-A617.0DF6A8BE-1AE0-40CE-98D1-5B17DCB44FE7,"Addendum Discussion. The calculated MIB-1 labeling index is 3.0% consistent with a low grade oligodendroglioma. Addendum Diagnosis: Right Insular Tumor, including enhancing region. Oliogodendroglioma (who grade II). MIB-1 LI= 3.0%. Microscopic Description: Sections demonstrate gray and white matter that is diffusely infiltrated by a mildly to moderately. hypercellular glial neoplasm. The majority of the tumor cells have round nuclei with only mild atypia. Perinuclear halos are prominent in most. A minority component is a fibrillary astrocytoma phenotype or. a gemistocytic phenotype. In these sections, no mitosis are seen and there is no microvascular. proliferation or necrosis. A neo plastic ganglion cell component is not seen. Eosinophilic granular bodies. are not identified.","The microscopic description of the tumor reveals a mildly to moderately hypercellular glial neoplasm diffusely infiltrating gray and white matter, with the majority of tumor cells having round nuclei and mild atypia, and prominent perinuclear halos. A minority component shows a fibrillary astrocytoma or gemistocytic phenotype. No mitosis, microvascular proliferation, necrosis, or neoplastic ganglion cell component is observed. Eosinophilic granular bodies are also not identified. The calculated MIB-1 labeling index is 3.0%, consistent with a low-grade oligodendroglioma. The diagnosis is oligodendroglioma (WHO grade II) with a MIB-1 LI of 3.0%.","The microscopic description of the tumor reveals a mildly to moderately hypercellular glial neoplasm diffusely infiltrating gray and white matter, with the majority of tumor cells having round nuclei and mild atypia, and prominent perinuclear halos. A minority component shows a fibrillary astrocytoma or gemistocytic phenotype. No mitosis, microvascular proliferation, necrosis, or neoplastic ganglion cell component is observed. Eosinophilic granular bodies are also not identified. The calculated MIB-1 labeling index is 3.0%, consistent with a low-grade oligodendroglioma. The diagnosis is oligodendroglioma (WHO grade II) with a MIB-1 LI of 3.0%."
