case_id,patient_filename,text,summ,corrected
TCGA-B6-A0RO,TCGA-B6-A0RO.EFA0354A-641D-4EC2-A1BE-4ACC7CE421DF,"Patien. surgical F. CLINICAL HISTORY: Right breast Ca, rule out deep margin positive. GROSS EXAMINATION: A. ""#1 right modified radical mastectomy"", in formalin. Received in the. container is a portion of breast with an attached skin ellipse containing the. nipple and an axillary dissection. The specimen measures 18.5 x 14 x 3.9 cm. The attached skin ellipse measures 14.7 x 6.3 cm. The nipple appears grossly. unremarkable. There is a small 0.5 cm hole 1.7 cm inferior to the nipple. The. deep surface of the specimen is inked in blue and the specimen is serially. sectioned revealing a 3.5 x 2 x 1.5 cm firm white mass in the medial portion. of the specimen. The mass is fairly well-circumscribed but very firm to. palpation. Grossly it appears to approach within 0.2 cm of the deep surgical. margin. There is no definite biopsy cavity; however, there is a small area of. hemorrhage just adjacent to the tumor mass. Tissue from the tumor mass has. been sent for estrogen and progesterone receptors. Block Summary: A1- section through nipple. A2- section through hole in skin ellipse. A3-A5- sections of tumor with adjacent deep margin. A6-A9- representative sections of tumor. A10- representative sections of upper lateral quadrant. A11- representative section of lower lateral quadrant. A12- representative section of upper medial quadrant. A13- five lymph node candidates from level three. A14-A15- one large lymph node bisected, level three. A16- one large lymph node bisected and one small lymph node candidate, level. three. A17- one lymph node candidate bisected, level three. A18- one lymph node candidate bisected, level three. A19- four lymph node candidates from level II. A20- one lymph node candidate bisected from level II. A21- two lymph node candidates from level II. A22- five lymph node candidates from level I. A23- two lymph node candidates from level I. A24- two lymph node candidates from level I. A25- two lymph node candidates from level I. MICROSCOPIC EXAMINATION: Most of the tumor consists of tubules and cribriform glands composed of. atypical cells with a moderate amount of eosinophilic cytoplasm and oval. nuclei with distinct relatively small nucleoli. There is a sparse. inflammatory response. A minor non-comedo intraductal component is present,. within or near the tumor mass. Away from the tumor, no intraductal carcinoma. or epithelial hyperplasia is seen. DIAGNOSIS: A. ""RIGHT"" BREAST, MODIFIED RADICAL MASTECTOMY: INFILTRATING DUCTAL CARCINOMA (2.5 CM), NSABP HISTOLOGIC GRADE II/III,. NUCLEAR GRADE MODERATELY DIFFERENTIATED. A NON-COMEDO INTRADUCTAL CARCINOMA COMPONENT IS IDENTIFIED, COMPRISING. LESS THAN 10% OF THE CARCINOMA. NO TUMOR IS SEEN IN THE DEEP SURGICAL MARGIN. 1 of 2. NO VASCULAR INVASION IS IDENTIFIED. TWO OF SEVENTEEN (2/17) LYMPH NODES ARE POSITIVE FOR METASTATIC. ADENOCARCINOMA. BREAST TISSUE WITH APOCRINE METAPLASIA AND MICROCALCIFICATIONS IN. NON-NEOPLASTIC LOBULES. 2 of 2.","The patient underwent a right modified radical mastectomy for a right breast cancer, with a clinical history of a right breast cancer and a concern for a deep margin positive result. The microscopic examination revealed a tumor consisting of tubules and cribriform glands composed of atypical cells with a moderate amount of eosinophilic cytoplasm and oval nuclei with distinct relatively small nucleoli. The tumor was diagnosed as infiltrating ductal carcinoma, measuring 2.5 cm, with a histologic grade of II/III and nuclear grade moderately differentiated. A non-comedo intraductal carcinoma component was identified, comprising less than 10% of the carcinoma. The deep surgical margin was negative for tumor. Vascular invasion was not identified, but two of seventeen lymph nodes were positive for metastatic adenocarcinoma. Additional findings included breast tissue with apocrine metaplasia and microcalcifications in non-neoplastic lobules.","The patient underwent a right modified radical mastectomy for a right breast cancer, with a clinical history of a right breast cancer and a concern for a deep margin positive result. The microscopic examination revealed a tumor consisting of tubules and cribriform glands composed of atypical cells with a moderate amount of eosinophilic cytoplasm and oval nuclei with distinct relatively small nucleoli. The tumor was diagnosed as infiltrating ductal carcinoma, measuring 2.5 cm, with a histologic grade of II/III and nuclear grade moderately differentiated. A non-comedo intraductal carcinoma component was identified, comprising less than 10% of the carcinoma. The deep surgical margin was negative for tumor. Vascular invasion was not identified, but two of seventeen lymph nodes were positive for metastatic adenocarcinoma. Additional findings included breast tissue with apocrine metaplasia and microcalcifications in non-neoplastic lobules."
TCGA-2Y-A9H1,TCGA-2Y-A9H1.04B342FC-F63A-4C81-BFF7-556C0424BF97,"Final Diagnosis. A. LIVER, LEFT LATERAL SEGMENT, SEGMENTECTOMY: Hepatocellular carcinoma, see Key Pathological Findings. I,. the attending pathologist, personally reviewed the. entire case and rendered the final diagnosis. Electronically signed out by. Ancillary Studies. Immunohistochemistry stains were prformed with adequate controis on block A4 and revealed the. tumor cells to be positive for AFP, Hep-par1, CEA-p (canalicular pattern), CK7 and CK20. Special stains Trichrome, reticulin, and iron were performed with adequate controls on block A5 and. showed portal fibrosis with short fibrous septa and no excess iron. Key Pathological Findings. A: Liver, Resection, Synoptic Data. SPECIMEN TYPE: Left lateral segmentectomy. FOCALITY: Solitary (specify location): left lateral segment. TUMOR SIZE: 3.1 cm. HISTOLOGIC TYPE: Hepatocellular carcinoma. HISTOLOGIC GRADE: Gll: Moderately differentiated. PRIMARY TUMOR (pT): pT1: Solitary tumor with no vascular invasion. REGIONAL LYMPH NODES (pN): pNX: Cannot be assessed. DISTANT METASTASIS (pM): pMX: Cannot be assessed. MARGINS: Parenchymal margin uninvolved by invasive carcinoma. Distance of invasive carcinoma from closest margin: 9 mm. VENOUS (LARGE VESSEL) INVASION (V): Absent. ADDITIONAL PATHOLOGIC FINDINGS: Other (specify): fibrous expansion of some portal areas with short fibrous septa (modified. Ishak stage 1 ). Specimen(s) Received. A. LEFT LATERAL SEGMENT OF LIVER FS. Clinical History. LIVER CA. HCC. Preoperative Diagnosis. Liver cancer, HCC. Frozen Section Diagnosis. FSA1. LEFT LATERAL SEGMENT OF LIVER: Approximately 3.5 cm nodule at least 1 cm from all margins. Comment: This frozen section diagnosis/result was communicated to and acknowledged by. in. at. I,. have performed the intraoperative consultation and issued the above diagnosis. Gross Description. A. The specimen is received fresh labeled ""left lateral segment of liver"" and consists of a. previously incised. 138 gram, 11.9 x 7.8 x 4.2 cm wedge of liver with numerous staples at the. resection margin. The capsule is smooth, purple red with a 2.7 cm subcapsular nodule. Sectioning. reveals a 3.1 x 2.6 x 2.2 cm, tan yellow nodule which extends 1.1 cm from the parenchymal margin up. to the overlying capsule. The surrounding parenchyma is dense, tan brown and mildly indurated. The. parenchymal margin is inked blue, the specimen is serially sectioned and representative sections are. submitted as labeled: A1-A3: Tumor to parenchymal margin. A4-A5: Tumor to adjacent parenchyma and capsule. A7: Vascular margins. A8: Normal-appearing parenchyma. Tissue is submitted to Tissue Procurement Laboratory.","The patient underwent a left lateral segmentectomy for a liver mass. The tumor was a 3.1 cm hepatocellular carcinoma, moderately differentiated, with no vascular invasion. The tumor was solitary and located in the left lateral segment, with a clear margin of 9 mm from the closest resection margin. Immunohistochemistry stains revealed the tumor cells to be positive for AFP, Hep-par1, CEA-p (canalicular pattern), CK7, and CK20. Special stains showed portal fibrosis with short fibrous septa and no excess iron. The tumor was staged as pT1 with no lymph node involvement (pNX) or distant metastasis (pMX). The liver tissue showed fibrous expansion of some portal areas with short fibrous septa, classified as modified Ishak stage 1.","The patient underwent a left lateral segmentectomy. The tumor was a 3.1 cm hepatocellular carcinoma, moderately differentiated, with no vascular invasion. The tumor was solitary and located in the left lateral segment, with a clear margin of 9 mm from the closest resection margin. Immunohistochemistry stains revealed the tumor cells to be positive for AFP, Hep-par1, CEA-p (canalicular pattern), CK7, and CK20. Special stains showed portal fibrosis with short fibrous septa and no excess iron. The tumor was staged as pT1. Lymph node involvement and distant metastasis could not be assessed (pNX and pMX). The liver tissue showed fibrous expansion of some portal areas with short fibrous septa, classified as modified Ishak stage 1."
TCGA-GV-A3JZ,TCGA-GV-A3JZ.A1CF42EF-92A6-4214-BB25-7C71F665EFDC,"De-Identified Specimen Code. / M. SPECIMEN SUBMITTED: Part A: LEFT DISTAL URETER. Part B: LEFT PELVIC LYMPH NODE. Part C: RIGHT DISTAL URETER. Part D: FINAL URETHRAL MARGIN. Part E: BLADDER AND PROSTATE. Part F: LEFT DISTAL URETER #2. Part G: RIGHT PELVIC LYMPH NODES. Part H: RIGHT COMMON LYMPH NODES. Part I: LEFT COMMON LYMPH NODES. Part J: LEFT PELVIC LYMPH NODES. Part K: PRESACRAL LYMPH NODES. Final Diagnosis. 1. Left distal ureter, biopsy (A) - Atypical urothelial cells. 2. Left pelvic lymph nodes, excision (B) - Metastatic urothelial carcinoma involving one lymph node. 3. Right distal ureter and final urethral margin, biopsies (C, D) - Negative for neoplasm. 4. Bladder, excision (E) - Invasive poorly differentiated urothelial carcinoma with invasion through. muscular wall and involvement of perivesical adipose tissue. 5. Prostate, excision (E) - Urothelial carcinoma involving prostatic urethra with invasion into. adjacent prostatic parenchyma. 6. Left distal ureter #2, biopsy (F) - Negative for neoplasm. 7. Right pelvic lymph nodes, excision (G) - Negative for neoplasm, fourteen lymph nodes. 8. Right common lymph nodes, excision (H) - Negative for neoplasm, nine lymph nodes. 9. Left common lymph nodes, excision (I) - Metastatic urothelial carcinoma involving two of six. lymph nodes. 10. Left common lymph nodes, excision (J) - Metastatic urothelial carcinoma involving two of four. lymph nodes. 11. Presacral lymph nodes, excision (K) - Negative for neoplasm, five lymph nodes. Diagnosis Comment: 2. The carcinoma was only present in the permanent section and not present in the frozen section. 4. Specimen Type: Radical cystoprostatectomy. Tumor Size, Greatest dimension: 3.5 cm. Histologic Type: Urothelial carcinoma. Urothelial Carcinoma: (WHO/ISUP, 1998): High grade. Adenocarcinoma and Squamous Carcinoma: Not applicable. Associated Epithelial Lesions: None identified. Margins: Margins uninvolved by invasive carcinoma. Venous/Lymphatic (Large/Small Vessel) Invasion (V/L): Present. Direct Extension of Invasive Tumor: Perivesical fat. Prostatic stroma. Other Diagnoses: See above. Pathologic Stage: Primary Tumor: (pT). pT4a: Tumor invades prostate. Regional Lymph Nodes: (pN). pN3: Metastasis in common iliac lymph nodes The size of the largest metastasis is 2.2 cm. The tumor. extends beyond the lymph node capsules to involve the adjacent adipose tissue. Distant Metastasis (pM): pMX: Cannot be assessed. Clinical Diagnosis: BLADDER CA. Gross Description: A. Received fresh at the frozen desk is a specimen labeled ""left distal ureter"" consisting of one piece of. unoriented renal tissue measuring 0.8 x 0.6 X 0.3 cm. The specimen is totally submitted for frozen. section as A1. B. Received fresh at the frozen desk is a specimen labeled ""left pelvic lymph node"" consisting of one. ovoid nodule measuring 1.5 x 1 X 0.5 cm. The specimen is totally submitted for frozen section as B1. C. Received fresh at the frozen desk is a specimen labeled ""right distal ureter"" consisting of one piece. of unoriented luminal tissue measuring 0.7 x 0.7 x 0.3 cm. The specimen is totally submitted for frozen. section as C1. D. Received fresh at the frozen desk is a specimen labeled ""final urethral margin"" consisting of one. piece of unoriented tissue measuring 0.5 x 0.5 x 0.5 cm. The specimen is totally submitted for frozen. section in D1. E. Received in formalin previously opened and inked with the margins taken is a specimen which. consists of a urinary bladder, bilateral ureters, prostate and attached seminal vesicles and vas deferens. The bladder measures 13.0 x 9.0 x 5.5 cm. The external surface of the bladder is covered by a serosal. lining at the dome and fibroadipose tissue at the remaining portion. After the bladder is opened an. irregular, tan-white, firm area is identified measuring 3.5 x 3.0 cm. The mass appears to encompass the. entire trigone, the anterior, posterior, left bladder walls and both ureteral orifices. The mass is semisolid. with tan-brown to white, friable possible papillary areas. On sectioning, the mass appears to extend. through the left wall for a distance of 1.5 cm and is 0.2 cm from the soft tissue line of resection (inked. black). It does not appear to involve the perivesicular adipose tissue. Purulent material is present upon. sectioning of the left wall and left trigone. The remainder of the bladder wall appears edematous and. diffusely hemorrhagic. The hemorrhagic areas are predominantly visible on the posterior bladder wall. A. 3.0 cm segment of right ureter is present. It is probe patent. Its mucosa is slightly inflamed and. granular. A 2.0 cm segment of left ureter is present. It is probe patent and its mucosa is inflamed and. granular. The prostate measures 3.0 cm anteroposteriorly, 3.2 cm craniocaudally, and 4.0 cm. transversely. The capsular surface appears slightly roughened but complete. The gland is inked blue on. the right and yellow on the left, and sectioned from the apex to base transversely at 3 mm intervals. perpendicular to the urethra. The cross sections reveal a yellow-tan mottled cut surface. A definitive. mass is not identified. Rubbery nodularity is present. The seminal vesicles appear unremarkable. Segments of vas deferens appear unremarkable. Sectioning of the attached fibroadipose tissue reveals. three tan-white firm nodules, resembling lymph nodes ranging in size from 0.3-0.6 cm in greatest. dimension. Representative sections are submitted in formalin as follows: E1 right distal ureter shave,. E2 left distal ureter shave, E3-E4 anterior bladder wall, E5 left wall to include deepest extent of lesion,. E6 left ureteral orifice, E7-E8 left trigone, E9 posterior wall demonstrating hemorrhagic mucosa, E10. dome demonstrating hemorrhagic mucosa, E11 right ureteral orifice, E12 right wall, E13 right trigone,. E14 right ureteral mucosa (1.0 cm from distal margin), E15 left ureter mucosa (1.2 cm from distal. margin), E16 lymph nodes (3), E17 right apex, E18 left apex, E19 3 mm right, E20 3 mm left, E21 15. mm right anterior (capsular surface incomplete), E22 15 mm right posterior to include seminal vesicles,. E23 left anterior (capsular surface incomplete), E24 15 mm left posterior to include seminal vesicles. Gross Description: F. Received fresh at the frozen desk is a specimen labeled ""left distal ureter #2"" consisting of one piece. of unoriented luminal tissue measuring 1 x 0.5 x 0.5 cm. The specimen is totally submitted for frozen. section in F1. G. Received in formalin labeled ""right pelvic lymph nodes"" is a specimen consisting of multiple. fragments of fibrofatty tissue aggregating to 7 x 5 x 1.7 cm. On sectioning, 14 possible lymph nodes. are identified ranging in diameter from 0.2 to 1 cm. Sections are submitted as follows: G1 five possible. lymph nodes, G2 four possible lymph nodes, G3 four possible lymph nodes, G4 one possible lymph. node bisected. H. Received in formalin labeled ""right common lymph nodes"" is a specimen consisting of multiple. fragments of fibrofatty tissue aggregating to 3 x 2 x 1 cm. Nine possible lymph nodes are identified. ranging in diameter from 0.2 to 1.5 cm. Sections are submitted as follows: H1 four possible lymph. nodes, H2 four possible lymph nodes, H3 one possible lymph node sectioned and totally submitted. I. Received in formalin labeled ""left common lymph node"" is a specimen consisting of multiple. fragments of fibrofatty tissue aggregating to 9 x 4 x 2 cm. Four possible tan lymph nodes are identified,. two large lymph nodes measuring 3 and 4.5 cm in diameter. Sections are submitted as follows: 11 four. possible lymph nodes, 12-14 one lymph node sectioned and totally submitted, 15-18 one lymph node. sectioned and totally submitted. J. Received in formalin labeled ""left pelvic lymph nodes"" is a specimen consisting of multiple fragments. of fibrofatty tissue aggregating to 6 x 2.5 x 1.5 cm. Three possible lymph nodes are identified ranging in. diameter from 0.5 to 3 cm. Also present is an elongated firm cord-like structure measuring 5 x 0.5 x 0.4. cm. Sections are submitted as follows: J1 one lymph node sectioned and totally submitted, J2 one. lymph node, J3 cord-like structure sectioned and totally submitted, J4-J5 one lymph node sectioned. and totally submitted. K. Received in formalin labeled ""presacral lymph nodes"" is a specimen consisting of multiple fragments. of fibrofatty tissue aggregating to 3.5 X 2.5 X 0.5 cm. Five possible lymph nodes are identified ranging in. diameter from 0.1 to 0.6 cm. The five possible lymph nodes are submitted in K1.","The pathology report reveals the following results: 

The left distal ureter biopsy (A) shows atypical urothelial cells. The left pelvic lymph nodes (B) show metastatic urothelial carcinoma involving one lymph node. The right distal ureter and final urethral margin biopsies (C, D) are negative for neoplasm. The bladder and prostate excision (E) shows invasive poorly differentiated urothelial carcinoma with invasion through the muscular wall and involvement of perivesical adipose tissue. The urothelial carcinoma involves the prostatic urethra with invasion into adjacent prostatic parenchyma. The left distal ureter #2 biopsy (F) is negative for neoplasm. The right pelvic lymph nodes (G) are negative for neoplasm, with 14 lymph nodes examined. The right common lymph nodes (H) are negative for neoplasm, with 9 lymph nodes examined. The left common lymph nodes (I) show metastatic urothelial carcinoma involving 2 of 6 lymph nodes. The left common lymph nodes (J) show metastatic urothelial carcinoma involving 2 of 4 lymph nodes. The presacral lymph nodes (K) are negative for neoplasm, with 5 lymph nodes examined. Microscopic description of the bladder and prostate excision (E) shows a high-grade urothelial carcinoma with invasion through the muscular wall and involvement of perivesical adipose tissue, and the tumor extends beyond the lymph node capsules to involve the adjacent adipose tissue. The tumor size is 3.5 cm, and the largest metastasis is 2.2 cm. The clinical diagnosis is bladder cancer.","The pathology report reveals the following results: The left distal ureter biopsy (A) shows atypical urothelial cells. The left pelvic lymph nodes (B) show metastatic urothelial carcinoma involving one lymph node. The right distal ureter and final urethral margin biopsies (C, D) are negative for neoplasm. The bladder and prostate excision (E) shows invasive poorly differentiated urothelial carcinoma with invasion through the muscular wall and involvement of perivesical adipose tissue. The urothelial carcinoma involves the prostatic urethra with invasion into adjacent prostatic parenchyma. The left distal ureter #2 biopsy (F) is negative for neoplasm. The right pelvic lymph nodes (G) are negative for neoplasm, with 14 lymph nodes examined. The right common lymph nodes (H) are negative for neoplasm, with 9 lymph nodes examined. The left common lymph nodes (I) show metastatic urothelial carcinoma involving 2 of 6 lymph nodes. The left common lymph nodes (J) show metastatic urothelial carcinoma involving 2 of 4 lymph nodes. The presacral lymph nodes (K) are negative for neoplasm, with 5 lymph nodes examined. Microscopic description of the tumor shows a high-grade urothelial carcinoma with invasion through the muscular wall and involvement of perivesical adipose tissue. In lymph node metastases, the tumor extends beyond the lymph node capsules to involve the adjacent adipose tissue. The tumor size is 3.5 cm, and the largest metastasis is 2.2 cm. The clinical diagnosis is bladder cancer."
TCGA-BH-A208,TCGA-BH-A208.4F943D12-E769-45F3-86BE-75193786DD4E,"DIABNOSIS: 16 H&E STAINED SLIDES. PREVIOUS REPORTS: SPECIMEN DATE: LEFT MASTECTOMY: NEILTRATING DUCTAL CARCINOMA, NOT OTHERWISE SPECIFIED. 6.0. RY 2.0 BY 270 CM.. POORLY DIFFERENTIATED INTERMEDIATE. NUCLEAR GRADE EXTENDING TO WITHIN 1 MM OF LINE OF RESECTION. AND MASSIVE VASCULAR PERMEATION, INCLUDING NIPPLE. FIBROCYSTIC CHANGES. THREE OF FIFTEEN: (3/15) AXILLARY LYMPH NODES POSITIVE FOR. METASTATIC TUMOR WITH CAPSULAR AND EXTRACAPSULAR EXTENSION.","The pathology report reveals a diagnosis of poorly differentiated intermediate nuclear grade invasive ductal carcinoma, not otherwise specified, measuring 6.0 cm in size with a 2.0 cm margin. Microscopic examination of the slides shows the tumor extending within 1 mm of the line of resection and massive vascular permeation, including the nipple. Fibracyclic changes were also observed. Additionally, 3 out of 15 axillary lymph nodes were positive for metastatic tumor with capsular and extracapsular extension.","The pathology report reveals a diagnosis of poorly differentiated intermediate nuclear grade invasive ductal carcinoma, not otherwise specified. Microscopic examination of the slides shows the tumor extending within 1 mm of the line of resection and massive vascular permeation, including the nipple. Fibrocystic changes were also observed. Additionally, 3 out of 15 axillary lymph nodes were positive for metastatic tumor with capsular and extracapsular extension."
TCGA-BF-A3DJ,TCGA-BF-A3DJ.BF41787D-E227-4BD0-A090-A6A44B5763E0,Sex: Female. Diagnosis: Melanoma Histological description: Melanoma. Anatomic Site: Skin Tumor location: Primary. Tissue Specification: Tumor Specimen Matrix: Tissue Specimen Format: Frozen. Container: cryomold Type of Procurement: Surgery Grade: 3. T Stage: 4b N Stage: 1 M Stage: 0 Treatment: no. Treatment Details: no/no. Normal Sample. Anatomic Site: Blood Sample Type: normal Type of Procurement: Blood draw. Matrix: Blood Specimen Format: Frozen Container: tube.,"The patient is a female with a diagnosis of melanoma, specifically a primary skin tumor. Microscopic examination revealed melanoma. The tumor is classified as grade 3. The cancer has spread to the lymph nodes (N1) but not to distant sites (M0), indicating a T4b stage.","The patient is a female with a diagnosis of melanoma, specifically a primary skin tumor. Microscopic examination revealed melanoma. The tumor is classified as grade 3. The cancer is stage T4b and has spread to the lymph nodes (N1) but not to distant sites (M0)."
