case_id,patient_filename,text,summ,corrected
TCGA-14-1795,TCGA-14-1795.1619def7-f24e-49cf-b2fb-1879951e0c62,"Document Date: Date Collected: Date Received: PT: DIAGNOSIS: 1. BRAIN, LEFT FRONTAL, BIOPSY, FS1A, TP1A: - GLIOBLASTOMA MULTIFORME. 2. BRAIN, LEFT FRONTAL, EXCISION: - GLIOBLASTOMA MULTIFORME. (nlectronic Signature). SPECIMEN: 1. Left frontal brain lesion. 2. Left frontal brain lesion. CLINICAL HISTORY/OPERATIVE FINDINGS: Left frontal brain lesion. Left frontal craniotomy for tumor resection. GROSS DESCRIPTION: Two specimens are received, the first fresh for intraoperative consultation,. and the second in formalin, each labeled with the patient's name and hospital. number. Specimen #1 is labeled as ""left frontal brain lesion. "" The specimen consists. of three pieces of soft pink tissue measuring in aggregate 1.0 x 0.8 X 0.4. A portionis-submitted for touch prep-evaluation. A representative. section is submitted for intraoperative consultation and frozen section. diagnosis, and the remainder of the cryoblock is submitted in cassette. ""FS1A. "" The remainder of the tissue is entirely submitted in cassette ""1B."". Specimen #2 is labeled as ""left frontal brain lesion."" The specimen consists. of multiple pieces of hemorrhagic brain tissue, the largest measuring 3.0 x. 2. X 1.5 cm, and the remaining pieces measuring 2.2 X 0.7 X 0.5 cm in. aggregate. Serial sectioning of the largest piece shows an irregular, poorly. circumscribed, yellow soft mass extending to the margins of resection. The. largest piece is inked blue prior to sectioning. The specimen is entirely. submitted in cassettes ""2A"" through ""2F."". INTRAOPERATIVE CONSULTATION: FS1A, TP1A: BRAIN, LEFT FRONTAL, BIOPSY (FROZEN SECTION, TOUCH PREPARATION) : GLIOBLASTOMA MULTIFORME. MICROSCOPIC DESCRIPTION: Microscopic examination performed. Medical Records. 1.","The patient underwent a left frontal craniotomy for tumor resection. The microscopic examination of the brain tissue revealed a diagnosis of glioblastoma multiforme in both the biopsy and excision specimens. The microscopic description showed an irregular, poorly circumscribed, yellow soft mass extending to the margins of resection. The tumor was identified as glioblastoma multiforme in the frozen section (FS1A, TP1A) and in the final microscopic examination.","The patient underwent a left frontal craniotomy for tumor resection. The microscopic examination of the brain tissue revealed a diagnosis of glioblastoma multiforme in both the biopsy and excision specimens. The microscopic description showed an irregular, poorly circumscribed, yellow soft mass extending to the margins of resection. The tumor was identified as glioblastoma multiforme in the frozen section (FS1A, TP1A) and in the final microscopic examination."
TCGA-AA-3841,TCGA-AA-3841.a7348faf-df79-4765-8910-b183a408e905,"Diagnosis: This material shows in I) parts of an invasive adenocarcinoma of the colon G2 with penetration. of all parietal layers (pT3, L1, V1) and with free lymph nodes,. in II) an additional adenocarcinoma, of moderate differentiation G2, with infiltration of the. muscularis (pT2, L1, V1), as well as a tubular adenoma and a lymph node metastasis, thus. corresponding to N1 (1 of 16). Tumor classification: I. ICDO-DA M-8140/3, G2, pT3, L1, V1, pNO (0 of 24). II. ICDO-DA M-8140/3, G2, pT2, L1, V1, pN1 (1 of 16).","The pathology report shows two separate adenocarcinomas of the colon, both of moderate differentiation (G2). The first adenocarcinoma is invasive, penetrating all parietal layers (pT3) with lymph node involvement (N1, 1 of 16). The second adenocarcinoma is also invasive, infiltrating the muscularis (pT2), with lymph node involvement (pN1, 1 of 16). Microscopic examination revealed tubular adenoma and lymph node metastasis.","The pathology report shows two separate adenocarcinomas of the colon, both of moderate differentiation (G2). The first adenocarcinoma is invasive, penetrating all parietal layers (pT3) with no lymph node involvement (pN0, 0 of 24). The second adenocarcinoma is also invasive, infiltrating the muscularis (pT2), with lymph node involvement (pN1, 1 of 16). Other findings included tubular adenoma."
TCGA-CN-6996,TCGA-CN-6996.0475c8e9-f3aa-418f-8685-ea32cd6b89c8,"Report Type. Date of Event. F. Authored by. Hosp/Group. Record Status. FINAL DIAGNOSIS: PART 1: RIGHT HEMIGLOSSECTOMY. A. INVASIVE SQUAMOUS CELL CARCINOMA (4.2 CM), MODERATELY. DIFFERENTIATED, KERATINIZING, INVOLVING INTRINSIC TONGUE MUSCLES. B. VASCULAR AND PERINEURAL INVASION IS PRESENT. C. ANTERIOR, POSTERIOR, AND DEEP TONGUE MARGINS ARE FREE OF. CARCINOMA. CARCINOMA EXTENDS TO ANTERIOR AND POSTERIOR FLOOR OF MOUTH MARGINS. (see parts 2-6 for final true margins). D. PATHOLOGIC STAGE: pT3 N2b. PART 2: ANTERIOR FLOOR OF MOUTH MARGIN, RE-RESECTION. NO TUMOR SEEN. PART 3: POSTERIOR FLOOR OF MOUTH MARGIN, RE-RESECTION. NO TUMOR SEEN. PART 4: MEDIAL POSTERIOR FLOOR OF MOUTH/TONGUE, BIOPSY. INVASIVE SQUAMOUS CELL CARCINOMA, BASED ON ORIGINAL FROZEN SECTION. SLIDES. PART 5: NEW POSTERIOR MARGIN. NO TUMOR SEEN. PART 6: DEEP MUSCLE MARGIN. NO TUMOR SEEN. PART 7: RIGHT NECK DISSECTION, LEVELS 1 THROUGH 4. A. METASTATIC SQUAMOUS CELL CARCINOMA, UP TO 3.5 CM, IN FIVE (5) OF. TWENTY-FOUR (24) LYMPH NODES (5/24), INVOLVING LEVELS 1A AND 2. B. EXTRANODAL EXTENSION IS PRESENT. C. VASCULAR INVASION IS PRESENT. By Pathologist: My signature is attestation that I have personally reviewed the submitted. material(s) and the final diagnosis reflects that evaluation. GROSS DESCRIPTION: The specimen is received in seven parts. Part 1 is received fixed labeled with the patient' S name, initials XXX and. ""right hemi-glossectomy."" It consists of a wedge of tan connective tissue,. 5.8 x 3.2 X 1.6 cm, partially covered with an ulcerated gray-white mucosa. Upon cross-sectioning, a 4.2 X 1.6 X 0.9 cm, white, firm lesion is identified. Digital image photographs are taken. Normal tissue and tissue from tumor were. banked for. Head and Neck Tissue Bank. Ink Code: Blue anterior margin. Green posterior margin. Black all other margins. Red banked area. Cassette Code: 1AFS anterior and posterior margin, shave. 1BFS anterior tongue margin, shave. 1CFS posterior tongue margin margin, shave. 1DFS anterior floor of mouth margin, shave. 1EFS posterior floor of mouth margin, shave. 1F-11 representative sections of the tumor. Part 2 is received fixed labeled with the patient' S name, initials XXX and. ""resection anterior floor of mouth.' It consists of a 2.4 X 1.0 X 0.8 cm, tan. connective tissue and gray-white mucosa. A suture marks medial margin (inked. black) and the true margin was identified by the surgeon (inked blue). After. frozen section analysis the specimen is submitted in cassette 2AFS. Part 3 is received fixed labeled with the patient' name, initials XXX and. ""resection posterior floor of mouth."" It consists of 1.0 X 0.5 x 0.6 cm of. tan connective tissue and gray-white mucosa. A suture marks posterior margin. (inked black) and the true margin was identified by the surgeon (inked blue). After frozen section analysis, the specimen is submitted in cassette 3AFS. Part 4 is received fixed labeled with the patient' name, initials XXX and. ""medial posterior floor of mouth/tongue."" It consists of 0.9 x 0.7 X 0.6 cm. of tan, connective tissue and mucosa. A suture marks posterior margin (inked. black) and the true margin was identified by the surgeon (inked blue). After. frozen section analysis, the specimen is submitted in cassette 4AFS. Part 5 is received fixed labeled with the patient' name, initials XXX and. ""new posterior margin."" It consists of 2.2 X 1.3 X 0.8 cm of tan, connective. tissue and mucosa. A suture marks posterior margin (inked black) and the true. margin was identified by the surgeon (inked blue). After frozen section. analysis the specimen is submitted in cassette 5AFS. Part 6 is received fixed labeled with the patient' name, initials XXX and. ""deep muscle margin."" It consists of 1.1 X 0.8 X 0.5 cm of tan, brown,. connective tissue specimen. After frozen section analysis, the specimen is. submitted in cassette 6AFS. Part 7 is received fixed, labeled with the patient's name, initials, XXX and. ""right neck dissection, levels 1-4"". It consists of a tan-yellow, elongated. fibroadipose tissue measuring 15.0 X 7.2 X 2.3 cm with attached submandibular. gland measuring 4.0 X 3.0 x 1.7 cm. The specimen is divided into levels 1A,. 1B, level 2, level 3 and level 4. Three possible lymph nodes are identified. ranging in greatest dimension from 0.8 to 1.3 cm in level 1A. One lymph node. is identified measuring in greatest dimension 1.6 cm in level 1B. Four. possible lymph nodes are identified ranging in greatest dimension from 0.2 to. 3.5 cm in level 2. The largest lymph node is serially cross sectioned. revealing a cystic and necrotic cut surfaces. Eight possible lymph nodes are. identified ranging in greatest dimension from 0.7 to 2.5 cm in level 3. Four. possible lymph nodes are identified ranging in greatest dimension from 0.4 to. 1.6 cm in level 4. The submandibular gland is serially cross sectioned revealing a lobular. tan-yellow unremarkable parenchyma. Cassette code: 7A one lymph node, bisected, level 1A. 7B two lymph nodes, level 1A. 7C one lymph node, level 1B. 7D representative of submandibular gland. 7E 7F representative of largest lymph node, level 2. 7G three possible lymph nodes, level 2. 7H two possible lymph nodes, level 3. 7I 7J three possible lymph nodes in each, level 3. 7K four possible lymph nodes, level 4. 7L three possible lymph nodes, level 4. 7M one possible lymph node (received as a separate fragment from the main. specimen). INTRAOPERATIVE CONSULTATION: PART 1AFS: ANTERIOR AND POSTERIOR MARGINS, SHAVE (frozen section). A. SUFFICIENT FOR ANCILLARY STUDIES. B. BENIGN. C. NO TUMOR PRESENT. PART 1BFS: ANTERIOR TONGUE MARGIN, SHAVE (frozen section). A. SUFFICIENT FOR ANCILLARY STUDIES. B. BENIGN. C. NO TUMOR PRESENT. PART 1CFS: POSTERIOR TONGUE MARGIN, SHAVE (frozen section). A. SUFFICIENT FOR ANCILLARY STUDIES. B. BENIGN. C. NO TUMOR PRESENT. PART 1DFS: ANTERIOR FLOOR OF MOUTH MARGIN, SHAVE (frozen section). A. SUFFICIENT FOR ANCILLARY STUDIES. B. MALIGNANT. C. MICROSCOPIC FOCUS OF INVASIVE CLEAR CELL CARCINOMA AND SKELETAL MUSCLE. PART 1EFS: POSTERIOR FLOOR OF MOUTH MARGIN, SHAVE (frozen section). A. SUFFICIENT FOR ANCILLARY STUDIES. B. MALIGNANT. C. MICROSCOPIC FOCUS OF INVASIVE SQUAMOUS CELL CARCINOMA. D. SUBMUCOSAL SOFT TISSUE. PART 2AFS: ANTERIOR FLOOR OF MOUTH MARGIN (frozen section) -. A. SUFFICIENT FOR ANCILLARY STUDIES. B. BENIGN. C. NO TUMOR PRESENT, NO MUCOSA. PART 3AFS: POSTERIOR FLOOR OF MOUTH (frozen section). A. SUFFICIENT FOR ANCILLARY STUDIES. B. BENIGN. C. NO TUMOR PRESENT. PART 4AFS: MEDIAL POSTRIOR FLOOR OF MOUTH/TONGUE (frozen section). A. SUFFICIENT FOR ANCILLARY STUDIES. B. MALIGNANT. C. INVASIVE SQUAMOUS CELL CARCINOMA. PART 5AFS: NEW POSTERIOR MARGIN (frozen section). A. SUFFICIENT FOR ANCILLARY STUDIES. B. BENIGN. C. NO TUMOR PRESENT. PART 6AFS: DEEP MUSCLE MARGIN (frozen section). A. SUFFICIENT FOR ANCILLARY STUDIES. B. BENIGN. C. NO TUMOR PRESENT. MICROSCOPIC: Microscopic examination substantiates the above diagnosis. caa. The following statement applies to all immunohistochemistry, Insitu. Hybridization Assays (ISH & FISH), Molecular Anatomic Pathology, and. Immunofluorescent Testing: The testing was developed and its performance characteristics determined by. the. Department of Pathology, as required by the CLIA. regulations. The testing has not been cleared or approved for the. specific use by the U.S. Food and Drug Administration, but the FDA has. determined such approval is not necessary for clinical use. Tissue fixation. ranges from a minimum of 2 to a maximum of 84 hours. This laboratory is certified under the Clinical Laboratory Improvement. Amendments of. (""CLIA"") as qualified to perform high-complexity clinical. testing. Pursuant to the requirements of CLIA, ASR's used in this laboratory. have been established and verified for accuracy and precision. Additional. information about this type of test is available upon request. CASE SYNOPSIS: SYNOPTIC DATA - PRIMARY UPPER AERODIGESTIVE TRACT AND SALIVARY GLAND. TUMORS. SPECIMEN TYPE: Resection: Right hemiglossectomy. TUMOR SITE: Oral Cavity. TUMOR SIZE: Greatest dimension: 4.2 cm. HISTOLOGIC TYPE: Squamous cell carcinoma, conventional. HISTOLOGIC GRADE: G2. PRIMARY TUMOR (pT): pT3. REGIONAL LYMPH NODES (pN): pN2b. Number of regional lymph nodes examined: 24. Number of regional lymph nodes involved: 5. DISTANT METASTASIS (pM): pMX. MARGINS: Cannot be assessed. VENOUS/LYMPHATIC (LARGE/SMALL VESSEL) INVASION (V/L): Present. PERINEURAL INVASION: Present. PATIENT HISTORY: CHIEF COMPLAINT/PRE-OP/POST-OP DIAGNOSIS: T3 M2 of right oral/tongue. PROCEDURE: Hemi-glossectomy and neck dissection. SPECIFIC CLINICAL QUESTION: Margins and nodes. OUTSIDE TISSUE DIAGNOSIS: Yes, squamous cell carcinoma. PRIOR MALIGNANCY: No.. CHEMORADIATION THERAPY: No. ORGAN TRANSPLANT: No. IMMUNOSUPPRESSION: No. OTHER DISEASES: No. HISTO TISSUE SUMMARY/SLIDES REVIEWED: Part 1: Right Hemi Glossectomy. Stain/cnt. Block. H&E x 1. F. H&E x 1. G. H&E X 1. H. H&E X 1. I. H&E X 1. AFS. H&E x 1. BFS. H&E X 1. CFS. H&E x 1. DFS. H&E x 1. EFS. Part 2: Anterior floor of mouth. Stain/cnt. Block. H&E x 1. AFS. Part 3: Posterior floor of mouth. Stain/cnt Block. H&E x 1. AFS. Part 4: Medial posterior floor of mouth. Stain/cnt. Block. H&E x 1. AFS. Part 5: New posterior margin. Stain/cnt. Block. H&E X 1. AFS. Part 6: Deep muscle margin. Stain/cnt. Block. H&E X 1. AFS. Part 7: Right Neck Dissection. Stain/cnt. Block. H&E x 1. A. H&E X 1. B. H&E x 1. C. H&E x 1. D. H&E x 1. E. H&E X 1. F. H&E x 1. G. H&E x 1. H. H&E x 1. I. H&E x 1. J. H&E x 1. K. H&E x 1. L. H&E X 1. M. TC1.","The patient underwent a right hemiglossectomy with neck dissection for a T3 squamous cell carcinoma of the oral cavity. The tumor was moderately differentiated, keratinizing, and involved the intrinsic tongue muscles. Vascular and perineural invasion was present. The anterior, posterior, and deep tongue margins were free of carcinoma, but the carcinoma extended to the anterior and posterior floor of the mouth margins. The pathologic stage was pT3 N2b. The re-resection of the anterior and posterior floor of the mouth margins showed no tumor. The biopsy of the medial posterior floor of the mouth/tongue showed invasive squamous cell carcinoma based on the original frozen section slides. The neck dissection, levels 1 through 4, showed metastatic squamous cell carcinoma in five of 24 lymph nodes, involving levels 1A and 2, with extranodal extension and vascular invasion present. Microscopic examination substantiated the diagnosis of invasive squamous cell carcinoma.","The patient underwent a right hemiglossectomy with neck dissection for a T3 squamous cell carcinoma of the oral cavity. The tumor was moderately differentiated, keratinizing, and involved the intrinsic tongue muscles. Vascular and perineural invasion was present. The anterior, posterior, and deep tongue margins were free of carcinoma, but the carcinoma extended to the anterior and posterior floor of the mouth margins. The pathologic stage was pT3 N2b. The re-resection of the anterior and posterior floor of the mouth margins showed no tumor. The biopsy of the medial posterior floor of the mouth/tongue showed invasive squamous cell carcinoma based on the original frozen section slides. The neck dissection, levels 1 through 4, showed metastatic squamous cell carcinoma in five of 24 lymph nodes, involving levels 1A and 2, with extranodal extension and vascular invasion present. Microscopic examination substantiated the diagnosis of invasive squamous cell carcinoma."
TCGA-HS-A5N8,TCGA-HS-A5N8.23C57E99-5BF2-4CD2-AC62-E58D3FBBF273,"Sample Type TUMOUR. Diagnosis. Leiomyosarcoma. Year of Sample Collection. Age at Sample Collection (yrs). Days to Procedure Date. Days to Diagnosis. Type of Procedure. RESECT. Site of Tissue/Primary (Histology). Uterus, Ovary. Tumour Size (cm). 10. Histology. Leiomyosarcoma. Grade/Differentiation. X. Pathological T. T2b. Pathological N. NX. Clinical M. M0. Histology Comments. Sample Type BUFFY. Year of Sample Collection. Age at Sample Collection (yrs). Days to Procedure Date. Days to Diagnosis.","The pathology report indicates a diagnosis of Leiomyosarcoma, a type of cancer, with the sample collected from the uterus and ovary. The tumour size was 10cm. Microscopic examination revealed features consistent with Leiomyosarcoma, with a grade/differentiation of X. The tumour was classified as T2b, indicating a specific tumour size and extent, while lymph nodes were not assessed (NX). The cancer had not metastasized (M0).","The pathology report indicates a diagnosis of Leiomyosarcoma, a type of cancer, with the sample collected from the uterus and ovary. The tumour size was 10cm. Grade/differentiation could not be assessed. The tumour was classified as T2b, indicating a specific tumour size and extent, while lymph nodes were not assessed (NX). The cancer had not metastasized (M0)."
TCGA-E2-A14V,TCGA-E2-A14V.DC8FD7C7-A908-4B90-860F-04984244167C,"SPECIMENS: A. EXCISION LEFT BREAST. B. LEFT AXILLARY SKIN TAG. C. LEFT AXILLA S.L.N. #1. D. LEFT AXILLA S.L.N. #2. E. LEFT AXILLARY CONTENTS. SPECIMEN(S): A. EXCISION LEFT BREAST. B. LEFT AXILLARY SKIN TAG. C. LEFT AXILLA S.L. N. #1. D. LEFT AXILLA S.L.N. #2. E. LEFT AXILLARY CONTENTS. GROSS DESCRIPTION: A. EXCISION LEFT BREAST. Received fresh labeled with the patient's identification, ""Excision Left Breast"" is a 130g, 8 x 11 x 4cm oriented. (Single-Anterior, Double-Lateral, Triple-Superior) left lumpectomy with 5 x 2 cm tan pink unremarkable skin ellipse. Ink Code: Anterior-Yellow, Posterior-Black, Medial-Green, Lateral-Red, Superior-Blue, Inferior-Orange. The. specimen is serially sectioned from medial to lateral into 8 slices to reveal a 3 x 3 x 2.3cm gray white firm ill defined. mass, 0.5cm from the closest anterior-superior margins in slices 3-6. A portion of the specimen is submitted for. tissue procurement. Representative sections are submitted as follows: A1: medial margin slice 1. A2-A3: superior margin slice 2. A4: area next to mass slice 2. A5: skin slice 3. A6: mass with anterior margin slice. 3. A7: mass with deep margin slice 3. A8: mass with anterior margin slice 3. A9: mass with deep margin slice 3. A10: anterior/superior margin slice 4. A11: superior margin slice 4. A12: mass with anterior margin slice 4. A13: mass with deep margin slice 4. A14: mass with anterior margin slice 4. A15: mass with anterior/inferior margin slice 4. A16: mass slice 4. A17: deep margin slice 4. A18: deep/inferior margin slice 4. A19: mass with anterior margin slice 5. A20: superior margin slice 5. A21: mass slice 5. A22: mass with deep margin slice 5. A23-A24: anterior margin slice 5. A25: mass slice 5. A26-A27: mass with deep margin slice 5. A28-A29: mass with anterior margin slice 6. A30-A31: mass slice 6. A32: deep margin slice 6. A33: next to mass slice 7. A34-A35: deep margin slice 7. A36: lateral margin slice 8. B. LEFT AXILLARY SKIN TAGS. Received in formalin are two polypoid skin tags, 0.1 and 0.3 cm in diameter. Submitted entirely in cassette B1. C. LEFT AXILLARY SLN #1. Received fresh is a tan pink lymph node 1.0 x 0.6 x 0.3cm. The specimen is bisected and a touch prep is taken. Toto. C1. D. LEFT AXILLARY SLN #2. Received fresh is a tan pink lymph node 1.5 x 1.2 x 0.6cm. The specimen is bisected and a touch prep is taken. Toto. D1. E. LEFT AXILLARY CONTENTS. Received in formalin is a piece of yellow-tan adipose tissue, 9.5 x 0.5 x 2.7 cm. Multiple lymph nodes are identified. ranging in size from 0.1 to 2.7 cm. The larger lymph nodes are bisected and have variegated pink-tan coloration. There is a blood vessel, 0.9 cm and the length and 0.4 cm in diameter, which is clipped at both ends. It contains. blood clot. Specimen is submitted entirely: E1-E2: 6 lymph nodes each. E3-E5: 2 lymph nodes each. E6-E8: 1 lymph node each. E9-E10: 1 lymph node. E11-E25: remainder of soft tissue. DIAGNOSIS: A. BREAST, LEFT, WIDE LOCAL EXCISION: - INVASIVE DUCTAL CARCINOMA, POORLY DIFFERENTIATED. (SBR GRADE 3). - INVASIVE CARCINOMA MEASURES 3 CM IN GREATEST DIMENSION. - MARGINS, FREE OF TUMOR. - LYMPHVASCULAR INVASION IS PRESENT. - DUCTAL CARCINOMA IN SITU (DCIS), SOLID AND MICROPAPILLARY. TYPES, NUCLEAR GRADE 3, WITH NECROSIS AND MICROCALCIFICATIONS. DCIS IS WITHIN 3 MM OF THE SUPERIOR MARGIN AND IS WITHIN. 4 MM OF THE POSTERIOR MARGIN. - SKIN, NO TUMOR SEEN. B. AXILLA, LEFT, SKIN TAG, EXCISION: - ACROCHORDONS. C. SENTINEL LYMPH NODE #1, LEFT AXILLA, BIOPSY: - METASTATIC CARCINOMA (0.3 CM IN SIZE) TO ONE LYMPH NODE (1/1). D. SENTINEL LYMPH NODE #2, LEFT AXILLA, BIOPSY: - METASTATIC CARCINOMA (1.5 CM IN SIZE) TO ONE LYMPH NODE WITH. FOCAL EXTRANODAL EXTENSION (1/1). E. AXILLARY CONTENTS, LEFT, DISSECTION: - METASTATIC CARCINOMA (0.8 CM IN SIZE) TO ONE OF 22 LYMPH NODES. (1/22). SYNOPTIC REPORT - BREAST. Specimen Type: Excision. Needle Localization: Laterality: Left. Invasive Tumor: Present. Multifocality: No. WHO CLASSIFICATION. Invasive ductal carcinoma, NOS 8500/3. Tumor size: 3cm. Tumor Site: Lower inner quadrant. Margins: Negative. Distance from closest margin: 0.5cm. anterior. Tubular Score: 3. Nuclear Grade: 3. Mitotic Score: 3. Modified Scarff Bloom Richardson Grade: 3. Necrosis: Absent. Vascular/Lymphatic Invasion: Present. Lobular neoplasia: None. Lymph nodes: Sentinel lymph node and axillary dissection. Lymph node status: Positive 3 /24 Extranodal extension. DCIS present. Margins uninvolved by DCIS. DCIS Quantity: Estimate 40%. DCIS Type: Solid. Micropapillary. DCIS Location: Associated with invasive tumor. Nuclear grade: High. Necrosis: Present. Location of CA++: DCIS. Stroma. ER/PR/HER2 Results. ER: Positive. PR: Positive. HER2: Pending. Pathological staging (pTN): pT2N1. CLINICAL HISTORY: 5cm tumor-Invasive Cancer on Core Bx. Lower Inner Quadrant Left Breast. PRE-OPERATIVE DIAGNOSIS: Left breast cancer. INTRAOPERATIVE CONSULTATION: A. GROSS INSPECTION: 3cm mass, 0.5cm from the closest Anterior margin. TPC-TPD: Positive for Adenocarcinoma. Diagnoses called to Dr. at. (A) and. (C-D) by Dr. ADDENDUM: SYNOPTIC REPORT - BREAST HER-2 RESULTS. Specimen: Surgical Excision. Block Number: A16. Interpretation: POSITIVE. Intensity: % Tumor Staining: 100%. Fish Ordered: No. METHODOLOGY: Tissue was fixed in 10% neutral buffered formalin for no less than 8 and nn longer than 24 hours. Her2 analysis. was performed using the FDA approved Dako HercepTest (TM) test kit. using rabbit anti-. human HER2. This assay was not modified. External kit-slides provided by the manufacturer (cell lines with high,. low and negative HER2 protein expression) and in-house known HER2 amplified control tissue were evaluated along. with the test tissue. Adequate, well preserved, clear-cut invasive carcinoma was identified for HER2 evaluation. Interpretation of the HER2 immunohistochemical stain is guided by published results in the medical literature,. information provided by the reagent manufacturer and by internal review of staining performance. This assay has been validated according to the 2007 joint recommendations and guidelines from ASCO. and. CAP. and from the NCCN HER2 testing in Breast Cancer Task Force. The Pathology Department takes full responsibility. for this test's performance. Microscopic/Diagnostic Dictation Pathologist,. Final Review: Pathologist,. Final Review: Pathologist. Final: Pathologist,. Addendum: Pathologist. Addendum Final: Pathoiogist, 1.","The patient underwent a wide local excision of the left breast, which revealed invasive ductal carcinoma, poorly differentiated (SBR grade 3), measuring 3 cm in greatest dimension. The margins were free of tumor. Lymphovascular invasion was present. Ductal carcinoma in situ (DCIS), solid and micropapillary types, nuclear grade 3, with necrosis and microcalcifications, was also identified, within 3 mm of the superior margin and within 4 mm of the posterior margin. The skin was uninvolved by tumor. The sentinel lymph node #1 showed metastatic carcinoma (0.3 cm in size) to one lymph node, and sentinel lymph node #2 showed metastatic carcinoma (1.5 cm in size) with focal extranodal extension. The axillary contents dissection revealed metastatic carcinoma (0.8 cm in size) to one of 22 lymph nodes. The patient's clinical history included a 5 cm tumor with invasive cancer on core biopsy in the lower inner quadrant of the left breast. The preoperative diagnosis was left breast cancer. The HER2 results were positive, with 100% tumor staining. The pathology report also noted the presence of acrochordons in the left axillary skin tag excision.","The patient underwent a wide local excision of the left breast, which revealed invasive ductal carcinoma, poorly differentiated (SBR grade 3), measuring 3 cm in greatest dimension. The margins were free of tumor. Lymphovascular invasion was present. Ductal carcinoma in situ (DCIS), solid and micropapillary types, nuclear grade 3, with necrosis and microcalcifications, was also identified, within 3 mm of the superior margin and within 4 mm of the posterior margin. The skin was uninvolved by tumor. The sentinel lymph node #1 showed metastatic carcinoma (0.3 cm in size) to one lymph node, and sentinel lymph node #2 showed metastatic carcinoma (1.5 cm in size) with focal extranodal extension. The axillary contents dissection revealed metastatic carcinoma (0.8 cm in size) to one of 22 lymph nodes. The patient's clinical history included a 5 cm tumor with invasive cancer on core biopsy in the lower inner quadrant of the left breast. The preoperative diagnosis was left breast cancer. The HER2 results were positive, with 100% tumor staining. The pathology report also noted the presence of acrochordons in the left axillary skin tag excision."
